{
  "$schema": "http://json-schema.org/draft-07/schema#",
  "$id": "urn:javis-dog:jgr:conformance:state:vector:adr-0012",
  "title": "JGR v0.1 dashboard state conformance vector (ADR-0012 read model)",
  "description": "One black-box case for the JD-M07 read model: seeded workspaces, projects and stored events with received_at relative to a pinned now -> partial expectations on snapshot(workspaceId, { now }). Derived from ADR-0012 and JGR spec v0.1 §3-§6. See README.md for runner semantics.",
  "type": "object",
  "additionalProperties": false,
  "required": ["description", "contract", "now", "workspaces", "events", "snapshotOf", "expect"],
  "properties": {
    "$schema": { "type": "string" },
    "description": { "type": "string", "minLength": 1 },
    "contract": {
      "description": "Contract text the expectation is derived from (ADR-0012 section, spec section, sprint review focus).",
      "type": "string",
      "minLength": 1
    },
    "now": {
      "description": "Pinned instant passed as snapshot(workspaceId, { now }). Every offset in the vector is relative to it.",
      "type": "string",
      "pattern": "^\\d{4}-\\d{2}-\\d{2}T\\d{2}:\\d{2}:\\d{2}(\\.\\d{1,3})?Z$"
    },
    "workspaces": {
      "description": "Workspaces to create, keyed by a vector-local key (A, B, ...).",
      "type": "object",
      "minProperties": 1,
      "propertyNames": { "pattern": "^[A-Z]$" },
      "additionalProperties": { "$ref": "#/definitions/workspace" }
    },
    "events": {
      "description": "Rows to insert into the event store, in any order (the runner never relies on array order).",
      "type": "array",
      "items": { "$ref": "#/definitions/event" }
    },
    "snapshotOf": {
      "description": "Key of the workspace whose snapshot is taken.",
      "type": "string",
      "pattern": "^[A-Z]$"
    },
    "expect": { "$ref": "#/definitions/expect" }
  },
  "definitions": {
    "ref": {
      "description": "Opaque identifier, spec §3.",
      "type": "string",
      "pattern": "^[A-Za-z0-9_:-]{1,128}$"
    },
    "slug": { "type": "string", "pattern": "^[a-z0-9][a-z0-9-]{0,62}$" },
    "status": {
      "description": "Spec §5 status values. stale is never a status.",
      "enum": ["working", "waiting", "idle", "blocked", "failed", "completed"]
    },
    "nullableStatus": {
      "oneOf": [{ "$ref": "#/definitions/status" }, { "type": "null" }]
    },
    "eventType": {
      "description": "Spec §4 core type or x.<vendor>.<name> extension.",
      "type": "string",
      "pattern": "^(session\\.started|session\\.ended|agent\\.started|agent\\.stopped|heartbeat|task\\.started|task\\.completed|task\\.failed|attention\\.requested|usage\\.reported|error|x\\.[a-z0-9-]+\\.[a-z0-9_.-]+)$"
    },
    "pastOffsetMs": {
      "description": "Milliseconds relative to now; 0 or negative (before now).",
      "type": "integer",
      "maximum": 0
    },
    "nullablePastOffsetMs": {
      "oneOf": [{ "$ref": "#/definitions/pastOffsetMs" }, { "type": "null" }]
    },
    "count": { "type": "integer", "minimum": 0 },
    "workspace": {
      "type": "object",
      "additionalProperties": false,
      "required": ["name", "projects"],
      "properties": {
        "name": { "type": "string", "minLength": 1 },
        "projects": { "type": "array", "items": { "$ref": "#/definitions/project" } }
      }
    },
    "project": {
      "type": "object",
      "additionalProperties": false,
      "required": ["slug", "name"],
      "properties": {
        "slug": { "$ref": "#/definitions/slug" },
        "name": { "type": "string", "minLength": 1 },
        "lastSignalOffsetMs": {
          "description": "projects.last_signal_at = now + offset; null = NULL. Omitted: the newest received_at of this project's seeded events, or NULL when it has none (README: Seeding).",
          "$ref": "#/definitions/nullablePastOffsetMs"
        }
      }
    },
    "usageDelta": {
      "description": "Spec §6 usage_delta.",
      "type": "object",
      "additionalProperties": false,
      "minProperties": 1,
      "properties": {
        "input_tokens": { "$ref": "#/definitions/count" },
        "output_tokens": { "$ref": "#/definitions/count" },
        "cache_read_tokens": { "$ref": "#/definitions/count" },
        "cache_write_tokens": { "$ref": "#/definitions/count" },
        "reasoning_tokens": { "$ref": "#/definitions/count" },
        "cost_usd": { "type": "number", "minimum": 0 },
        "model": { "type": "string" },
        "estimated": { "type": "boolean" }
      }
    },
    "attributes": {
      "description": "Stored attributes. Vectors deliberately include keys other than tool_name (some outside the L0 allowlist) to prove they are never shown.",
      "type": "object",
      "maxProperties": 16,
      "additionalProperties": {
        "oneOf": [
          { "type": "string", "maxLength": 128 },
          { "type": "number" },
          { "type": "boolean" }
        ]
      }
    },
    "event": {
      "type": "object",
      "additionalProperties": false,
      "required": ["workspace", "project", "thread_ref", "type", "sequence", "receivedOffsetMs"],
      "properties": {
        "workspace": { "type": "string", "pattern": "^[A-Z]$" },
        "project": { "$ref": "#/definitions/slug" },
        "thread_ref": { "$ref": "#/definitions/ref" },
        "agent_ref": { "$ref": "#/definitions/ref" },
        "type": { "$ref": "#/definitions/eventType" },
        "status": { "$ref": "#/definitions/status" },
        "sequence": { "$ref": "#/definitions/count" },
        "receivedOffsetMs": { "$ref": "#/definitions/pastOffsetMs" },
        "occurredOffsetMs": {
          "description": "occurred_at = now + offset. Omitted: equal to receivedOffsetMs. May be positive (producer clock ahead, within the 5-minute skew limit of spec §10).",
          "type": "integer"
        },
        "usage_delta": { "$ref": "#/definitions/usageDelta" },
        "attributes": { "$ref": "#/definitions/attributes" }
      }
    },
    "counterExpect": {
      "type": "object",
      "additionalProperties": false,
      "required": ["value"],
      "properties": {
        "value": { "$ref": "#/definitions/count" },
        "lastSignalOffsetMs": { "$ref": "#/definitions/nullablePastOffsetMs" }
      }
    },
    "tokenCounterExpect": {
      "type": "object",
      "additionalProperties": false,
      "required": ["value"],
      "properties": {
        "value": { "$ref": "#/definitions/count" },
        "reports": { "$ref": "#/definitions/count" },
        "lastSignalOffsetMs": { "$ref": "#/definitions/nullablePastOffsetMs" }
      }
    },
    "threadKey": {
      "type": "object",
      "additionalProperties": false,
      "required": ["projectSlug", "threadRef"],
      "properties": {
        "projectSlug": { "$ref": "#/definitions/slug" },
        "threadRef": { "$ref": "#/definitions/ref" }
      }
    },
    "threadExpect": {
      "type": "object",
      "additionalProperties": false,
      "required": ["projectSlug", "threadRef"],
      "properties": {
        "projectSlug": { "$ref": "#/definitions/slug" },
        "threadRef": { "$ref": "#/definitions/ref" },
        "status": { "$ref": "#/definitions/nullableStatus" },
        "freshness": { "enum": ["fresh", "stale", "ended"] },
        "attention": { "type": "boolean" },
        "agents": { "$ref": "#/definitions/count" },
        "tasksCompleted": { "$ref": "#/definitions/count" },
        "inputTokens": { "$ref": "#/definitions/count" },
        "outputTokens": { "$ref": "#/definitions/count" },
        "lastType": { "$ref": "#/definitions/eventType" },
        "firstSignalOffsetMs": { "$ref": "#/definitions/pastOffsetMs" },
        "lastSignalOffsetMs": { "$ref": "#/definitions/pastOffsetMs" }
      }
    },
    "activityItemExpect": {
      "type": "object",
      "additionalProperties": false,
      "required": ["index"],
      "properties": {
        "index": { "type": "integer", "minimum": 0, "maximum": 24 },
        "atOffsetMs": { "$ref": "#/definitions/pastOffsetMs" },
        "projectSlug": { "$ref": "#/definitions/slug" },
        "threadRef": { "$ref": "#/definitions/ref" },
        "type": { "$ref": "#/definitions/eventType" },
        "status": { "$ref": "#/definitions/nullableStatus" },
        "toolName": { "type": ["string", "null"] }
      }
    },
    "projectExpect": {
      "type": "object",
      "additionalProperties": false,
      "required": ["slug"],
      "properties": {
        "slug": { "$ref": "#/definitions/slug" },
        "name": { "type": "string" },
        "freshness": { "enum": ["fresh", "stale", "ended", "never"] },
        "lastSignalOffsetMs": { "$ref": "#/definitions/nullablePastOffsetMs" },
        "freshThreads": { "$ref": "#/definitions/count" },
        "attentionThreads": { "$ref": "#/definitions/count" }
      }
    },
    "expect": {
      "description": "Partial expectations: a key that is omitted is not checked. Every listed field is compared exactly (README: Comparison).",
      "type": "object",
      "additionalProperties": false,
      "required": ["absentStrings"],
      "properties": {
        "overview": {
          "type": "object",
          "additionalProperties": false,
          "properties": {
            "activeProjects": { "$ref": "#/definitions/counterExpect" },
            "agentsWorking": { "$ref": "#/definitions/counterExpect" },
            "tokensLastHour": { "$ref": "#/definitions/tokenCounterExpect" },
            "tasksCompleted24h": { "$ref": "#/definitions/counterExpect" }
          }
        },
        "threadCount": {
          "description": "Exact length of snapshot.threads.",
          "$ref": "#/definitions/count"
        },
        "threads": {
          "description": "Each entry matches exactly one thread by (projectSlug, threadRef); position is not checked here.",
          "type": "array",
          "items": { "$ref": "#/definitions/threadExpect" }
        },
        "threadOrder": {
          "description": "snapshot.threads, mapped to (projectSlug, threadRef), must equal this list exactly and in order.",
          "type": "array",
          "items": { "$ref": "#/definitions/threadKey" }
        },
        "activity": {
          "type": "object",
          "additionalProperties": false,
          "required": ["length"],
          "properties": {
            "length": { "type": "integer", "minimum": 0, "maximum": 25 },
            "items": {
              "description": "Expectations for snapshot.activity[index].",
              "type": "array",
              "items": { "$ref": "#/definitions/activityItemExpect" }
            }
          }
        },
        "projectCount": {
          "description": "Exact length of snapshot.projects.",
          "$ref": "#/definitions/count"
        },
        "projects": {
          "description": "Each entry matches exactly one project by slug; order is not checked.",
          "type": "array",
          "items": { "$ref": "#/definitions/projectExpect" }
        },
        "absentStrings": {
          "description": "Substrings that MUST NOT occur in JSON.stringify(snapshot). $PROJECT_ID:<workspace key>:<slug> is replaced by that project's id.",
          "type": "array",
          "items": { "type": "string", "minLength": 3 }
        }
      }
    }
  }
}
