{
  "$schema": "./schema.json",
  "description": "Workspace B's projects, threads, usage, tasks and activity never reach workspace A's snapshot; A's quiet project stays never and every counter stays 0.",
  "contract": "ADR-0012 Decision outcome: Read model (workspace-scoped), Transport; SPRINT-04a Review focus",
  "now": "2026-10-28T12:00:00.000Z",
  "workspaces": {
    "A": {
      "name": "Workspace A",
      "projects": [
        {
          "slug": "alpha-quiet",
          "name": "Alpha quiet"
        }
      ]
    },
    "B": {
      "name": "Workspace B",
      "projects": [
        {
          "slug": "beta-api",
          "name": "Beta API"
        }
      ]
    }
  },
  "events": [
    {
      "workspace": "B",
      "project": "beta-api",
      "thread_ref": "cc_b20_work",
      "type": "heartbeat",
      "status": "working",
      "sequence": 2,
      "receivedOffsetMs": -15000
    },
    {
      "workspace": "B",
      "project": "beta-api",
      "thread_ref": "cc_b20_work",
      "type": "task.completed",
      "sequence": 3,
      "receivedOffsetMs": -12000,
      "attributes": {
        "tool_name": "BETA_TOOL_MARKER"
      }
    },
    {
      "workspace": "B",
      "project": "beta-api",
      "thread_ref": "cc_b20_wait",
      "type": "attention.requested",
      "status": "waiting",
      "sequence": 1,
      "receivedOffsetMs": -10000
    },
    {
      "workspace": "B",
      "project": "beta-api",
      "thread_ref": "cc_b20_work",
      "type": "usage.reported",
      "sequence": 1,
      "receivedOffsetMs": -300000,
      "usage_delta": {
        "input_tokens": 123,
        "output_tokens": 45
      }
    }
  ],
  "snapshotOf": "A",
  "expect": {
    "absentStrings": [
      "beta-api",
      "Beta API",
      "cc_b20_work",
      "cc_b20_wait",
      "BETA_TOOL_MARKER",
      "$PROJECT_ID:B:beta-api"
    ],
    "overview": {
      "activeProjects": {
        "value": 0,
        "lastSignalOffsetMs": null
      },
      "agentsWorking": {
        "value": 0,
        "lastSignalOffsetMs": null
      },
      "tokensLastHour": {
        "value": 0,
        "reports": 0,
        "lastSignalOffsetMs": null
      },
      "tasksCompleted24h": {
        "value": 0,
        "lastSignalOffsetMs": null
      }
    },
    "threadCount": 0,
    "activity": {
      "length": 0
    },
    "projectCount": 1,
    "projects": [
      {
        "slug": "alpha-quiet",
        "freshness": "never",
        "lastSignalOffsetMs": null,
        "freshThreads": 0,
        "attentionThreads": 0
      }
    ]
  }
}
